
/dev/hda:

ATA device, with non-removable media
	Model Number:       HDT722516DLAT80                         
	Serial Number:      VD271BTCC9PPTC
	Firmware Revision:  V43OA70A
Standards:
	Used: ATA/ATAPI-7 T13 1532D revision 1 
	Supported: 7 6 5 4 
Configuration:
	Logical		max	current
	cylinders	16383	65535
	heads		16	1
	sectors/track	63	63
	--
	CHS current addressable sectors:    4128705
	LBA    user addressable sectors:  268435455
	LBA48  user addressable sectors:  321672960
	device size with M = 1024*1024:      157066 MBytes
	device size with M = 1000*1000:      164696 MBytes (164 GB)
Capabilities:
	LBA, IORDY(can be disabled)
	Standby timer values: spec'd by Standard, no device specific minimum
	R/W multiple sector transfer: Max = 16	Current = 0
	Advanced power management level: unknown setting (0x0000)
	Recommended acoustic management value: 128, current value: 254
	DMA: mdma0 mdma1 mdma2 udma0 udma1 udma2 udma3 udma4 *udma5 udma6 
	     Cycle time: min=120ns recommended=120ns
	PIO: pio0 pio1 pio2 pio3 pio4 
	     Cycle time: no flow control=240ns  IORDY flow control=120ns
Commands/features:
	Enabled	Supported:
	    	SMART feature set
	    	Security Mode feature set
	   *	Power Management feature set
	   *	Write cache
	   *	Look-ahead
	   *	Host Protected Area feature set
	   *	WRITE_BUFFER command
	   *	READ_BUFFER command
	   *	DOWNLOAD_MICROCODE
	    	Advanced Power Management feature set
	    	Power-Up In Standby feature set
	    	SET_FEATURES required to spinup after power up
	    	Address Offset Reserved Area Boot
	    	SET_MAX security extension
	   *	Automatic Acoustic Management feature set
	   *	48-bit Address feature set
	   *	Device Configuration Overlay feature set
	   *	Mandatory FLUSH_CACHE
	   *	FLUSH_CACHE_EXT
	   *	SMART error logging
	   *	SMART self-test
	    	Media Card Pass-Through
	   *	General Purpose Logging feature set
	   *	64-bit World wide name
	   *	URG for READ_STREAM[_DMA]_EXT
	   *	URG for WRITE_STREAM[_DMA]_EXT
Security: 
	Master password revision code = 65534
		supported
	not	enabled
	not	locked
	not	frozen
	not	expired: security count
	not	supported: enhanced erase
	78min for SECURITY ERASE UNIT. 
HW reset results:
	CBLID- above Vih
	Device num = 0 determined by the jumper
Checksum: correct
